<?xml version="1.0" encoding="utf-8"?>
<Dictionary xmlns:xsi="http://www.w3.org/2001/XMLSchema-instance" xsi:noNamespaceSchemaLocation="CustomDictionary.xsd">
    <Words>
        <Recognized>
            <Word>Colore</Word>
            <Word>Numlock</Word>
            <Word>Numpad</Word>
            <Word>半角/全角</Word>
            <Word>Razer</Word>
            <Word>Razer's</Word>
            <Word>BlackWidow</Word>
            <Word>半角</Word>
            <Word>全角</Word>
            <Word>無変換</Word>
            <Word>変換</Word>
            <Word>ひらがな</Word>
            <Word>カタカナ</Word>
            <Word>한자</Word>
            <Word>Fn</Word>
        </Recognized>
    </Words>
    <Acronyms>
        <CasingExceptions>
            <Acronym>Fn</Acronym>
        </CasingExceptions>
    </Acronyms>
</Dictionary>
